{
  "$schema": "../schemas/tauri-lua.schema.json",
  "productName": "tauri-lua-app",
  "version": "1.0.0",
  "identifier": "com.tauri.lua",
  "build": {
    "frontendDist": "../dist",
    "devUrl": ""
  },
  "dependencies": {
    "luarocks": [
      "inspect 3.1.3-0"
    ]
  },
  "app": {
    "windows": [
      {
        "title": "Tauri Lua Application",
        "width": 1024,
        "height": 720,
        "resizable": true
      }
    ],
    "security": {
      "capabilities": [
        "core:default",
        "state:set",
        "fs:read-text-file",
        "fs:write-text-file",
        "fs:read-dir",
        "dialog:open",
        "dialog:save",
        "dialog:message",
        "clipboard:read-text",
        "clipboard:write-text",
        "notification:send",
        "shell:execute"
      ],
      "csp": "default-src 'self' tauri: asset:; script-src 'self' tauri: asset:; style-src 'self' 'unsafe-inline'; img-src 'self' asset: data: tauri:; connect-src 'self' tauri: ipc:;",
      "scope": [
        "$APPDATA/com.tauri.lua/**",
        "$DESKTOP/tauri-app-sandbox/**",
        "$HOME/Documents/tauri-app-sandbox/**"
      ]
    }
  },
  "package": {
    "name": "tauri-lua-app",
    "version": "1.0.0"
  },
  "plugins": {
    "single-instance": {
      "enabled": true
    }
  }
}